{
  "schema_version": 4,
  "component": "plenora-rest-tools",
  "contracts_source": {
    "repository": "https://github.com/PlenoraETL/plenora-contracts.git",
    "revision": "3aec9f724f5a0ad21366f293895b4d0dbcd0aad1"
  },
  "profile": "plenora-rest-tools-profile-v1",
  "artifacts": [
    {
      "name": "plenora-rest-core",
      "surface": "rust",
      "version": "0.3.0",
      "digest": "sha256:a778b8955c9df08cfbc0d42f02514170563ad32adeab186e18528af6eab66031",
      "verification": [
        "powershell -File scripts/release.ps1",
        "cargo test -p plenora-rest-core --test public_surface",
        "cargo test -p plenora-rest-core --test black_box"
      ]
    },
    {
      "name": "plenora-rest",
      "surface": "python_sdk",
      "version": "0.3.0",
      "digest": "sha256:a37e8912a79917594e35c95a4cb0935e79561c00eaaddc64890082e00fc72ee6",
      "api_modes": [
        "sync"
      ],
      "verification": [
        "powershell -File scripts/release.ps1",
        "install wheel in a clean virtualenv and run python/tests/test_smoke.py"
      ]
    },
    {
      "name": "plenora-rest-linux-x86_64",
      "surface": "cli",
      "version": "0.3.0",
      "digest": "sha256:fb43b8f01791d020a0fb46f7d93aee608701a793b0014557c3e4b171e863ef10",
      "verification": [
        "powershell -File scripts/release.ps1",
        "cargo test -p plenora-rest-cli --test cli"
      ]
    },
    {
      "name": "plenora.rest-tools",
      "surface": "runtime",
      "version": "0.3.0",
      "digest": "sha256:a778b8955c9df08cfbc0d42f02514170563ad32adeab186e18528af6eab66031",
      "verification": [
        "powershell -File scripts/release.ps1",
        "cargo test -p plenora-rest-core --test runtime_binding",
        "cargo test -p plenora-rest-core --test runtime_vectors"
      ]
    }
  ],
  "contracts": [
    {
      "id": "plenora-public-surfaces-v1",
      "status": "conforming",
      "verification": [
        "cargo test -p plenora-rest-core --test public_surface",
        "installed-wheel black-box unittest suite"
      ]
    },
    {
      "id": "plenora-capabilities-v2",
      "status": "conforming",
      "verification": [
        "cargo test -p plenora-rest-core capability",
        "installed-wheel black-box unittest suite"
      ]
    },
    {
      "id": "plenora-error-v1",
      "status": "conforming",
      "verification": [
        "cargo test -p plenora-rest-core --test black_box",
        "cargo test -p plenora-rest-core --test runtime_binding",
        "cargo test -p plenora-rest-core --test runtime_vectors"
      ]
    },
    {
      "id": "plenora-public-security-v1",
      "status": "conforming",
      "verification": [
        "cargo test -p plenora-rest-core --test black_box",
        "cargo test -p plenora-rest-core --test runtime_binding",
        "cargo test -p plenora-rest-core --test runtime_vectors"
      ]
    },
    {
      "id": "plenora-python-sdk-v1",
      "status": "conforming",
      "verification": [
        "installed-wheel black-box unittest suite"
      ]
    },
    {
      "id": "plenora-runtime-binding-v2",
      "status": "conforming",
      "verification": [
        "cargo test -p plenora-rest-core --test runtime_binding",
        "cargo test -p plenora-rest-core --test runtime_vectors",
        "RT-024 deviation: docs/limiti.md; contracts/adoption-requirements.json"
      ]
    },
    {
      "id": "plenora-cli-v2",
      "status": "conforming",
      "verification": [
        "cargo test -p plenora-rest-cli --test cli",
        "cargo test -p plenora-rest-cli --bin plenora-rest"
      ]
    },
    {
      "id": "plenora-arrow-interchange-v1",
      "status": "not_applicable"
    },
    {
      "id": "plenora-surface-bindings-v1",
      "status": "conforming",
      "verification": [
        "cargo test -p plenora-rest-core --test public_surface",
        "cargo test -p plenora-rest-core --test runtime_binding",
        "installed-wheel black-box unittest suite",
        "cargo test -p plenora-rest-core --test runtime_vectors"
      ]
    },
    {
      "id": "plenora-composition-v1",
      "status": "conforming",
      "verification": [
        "cargo test -p plenora-rest-core --test runtime_binding"
      ]
    },
    {
      "id": "plenora-public-catalog-v2",
      "status": "conforming",
      "verification": [
        "python scripts/validate_contracts.py",
        "Existing rest-tools-v1 catalog/profile retained; CAT-001..003 adoption: contracts/adoption-requirements.json"
      ]
    },
    {
      "id": "plenora-interop-vectors-v1",
      "status": "not_applicable"
    },
    {
      "id": "plenora-arrow-geometry-semantics-v1",
      "status": "not_applicable"
    },
    {
      "id": "plenora-rest-arrow-adapter-v1",
      "status": "not_applicable"
    }
  ],
  "deviations": [
    {
      "rule": "RT-024",
      "surface": "runtime",
      "observed_behavior": "Response, file and pagination bounds yield resource_limit. Aggregate result materialization has no byte budget; allocation exhaustion may terminate the process instead of returning a typed error. Transport bounds belong to the host.",
      "tracking": "docs/limiti.md: RT-024; re-entry: bounded aggregate serialization and host budget, with boundary tests.",
      "detectable_before_invocation": false
    }
  ]
}
